{
  "$schema": "http://json-schema.org/draft-07/schema#",
  "title": "Element",
  "type": "object",
  "properties": {
    "id": {
      "type": "string"
    },
    "display_name": {
      "type": "string"
    },
    "match_bonus": {
      "type": "number"
    },
    "description": {
      "type": "string"
    }
  },
  "required": [
    "id",
    "display_name",
    "match_bonus",
    "description"
  ],
  "additionalProperties": false
}